[
  {
    "package": "package1",
    "name": "asset1",
    "hold": false,
    "localPath": "path/asset1.min.js",
    "assetManager": {
      "name": "cdnjs",
      "library": "library",
      "fileName": "asset1.min.js"
    },
    "currentVersion": "0.0.1"
  },
  {
    "package": "package2",
    "name": "asset2",
    "hold": false,
    "localPath": "./path/asset2.min.js",
    "assetManager": {
      "name": "github",
      "owner": "owner",
      "repository": "repository",
      "filePath": "dir/asset2.min.js"
    }
  },
  {
    "package": "package3",
    "name": "asset3",
    "hold": false,
    "localPath": "./path/asset3.min.js",
    "assetManager": {
      "name": "unpkg",
      "library": "asset3",
      "filePath": "dist/asset3.min.js"
    }
  },
  {
    "package": "package4",
    "name": "asset4",
    "hold": false,
    "localPath": "./path/asset4.min.js",
    "assetManager": {
      "name": "jsdelivr",
      "cdn": "npm",
      "package": "asset4",
      "filePath": "dist/asset4.min.js"
    }
  }
]